{
  "artifactKind": "preview-candidates",
  "counts": {
    "deferredParserRows": 5,
    "rows": 37,
    "safeParsedPreviewCandidates": 16,
    "warningPreviewCandidates": 16
  },
  "generatedAt": "2026-06-03T01:20:07Z",
  "generatedFrom": [
    ".config/ags/widget/hyprland-settings/parsedPreviewCandidateIds.ts",
    ".config/ags/widget/hyprland-settings/warningPreviewCandidateIds.ts",
    ".config/hypr/docs/HYPRLAND-0.55.2-DEFERRED-PARSER-ROWS-DESIGN.md"
  ],
  "hyprlandVersion": "0.55.2",
  "items": [
    {
      "fixtureBacked": true,
      "liveReadBacked": false,
      "previewKind": "color",
      "rawValueRequired": false,
      "rowId": "decoration.shadow.color",
      "snapshotMetadataKind": "parsedPreviewRowIds",
      "status": "safe-parsed-preview",
      "valueFamily": "color",
      "warningCopy": "Read-only parsed preview metadata."
    },
    {
      "fixtureBacked": true,
      "liveReadBacked": false,
      "previewKind": "color",
      "rawValueRequired": false,
      "rowId": "decoration.shadow.color_inactive",
      "snapshotMetadataKind": "parsedPreviewRowIds",
      "status": "safe-parsed-preview",
      "valueFamily": "color",
      "warningCopy": "Read-only parsed preview metadata."
    },
    {
      "fixtureBacked": true,
      "liveReadBacked": false,
      "previewKind": "color",
      "rawValueRequired": false,
      "rowId": "decoration.glow.color",
      "snapshotMetadataKind": "parsedPreviewRowIds",
      "status": "safe-parsed-preview",
      "valueFamily": "color",
      "warningCopy": "Read-only parsed preview metadata."
    },
    {
      "fixtureBacked": true,
      "liveReadBacked": false,
      "previewKind": "color",
      "rawValueRequired": false,
      "rowId": "decoration.glow.color_inactive",
      "snapshotMetadataKind": "parsedPreviewRowIds",
      "status": "safe-parsed-preview",
      "valueFamily": "color",
      "warningCopy": "Read-only parsed preview metadata."
    },
    {
      "fixtureBacked": true,
      "liveReadBacked": false,
      "previewKind": "color",
      "rawValueRequired": false,
      "rowId": "group.groupbar.text_color",
      "snapshotMetadataKind": "parsedPreviewRowIds",
      "status": "safe-parsed-preview",
      "valueFamily": "color",
      "warningCopy": "Read-only parsed preview metadata."
    },
    {
      "fixtureBacked": true,
      "liveReadBacked": false,
      "previewKind": "color",
      "rawValueRequired": false,
      "rowId": "group.groupbar.text_color_inactive",
      "snapshotMetadataKind": "parsedPreviewRowIds",
      "status": "safe-parsed-preview",
      "valueFamily": "color",
      "warningCopy": "Read-only parsed preview metadata."
    },
    {
      "fixtureBacked": true,
      "liveReadBacked": false,
      "previewKind": "color",
      "rawValueRequired": false,
      "rowId": "group.groupbar.text_color_locked_active",
      "snapshotMetadataKind": "parsedPreviewRowIds",
      "status": "safe-parsed-preview",
      "valueFamily": "color",
      "warningCopy": "Read-only parsed preview metadata."
    },
    {
      "fixtureBacked": true,
      "liveReadBacked": false,
      "previewKind": "color",
      "rawValueRequired": false,
      "rowId": "group.groupbar.text_color_locked_inactive",
      "snapshotMetadataKind": "parsedPreviewRowIds",
      "status": "safe-parsed-preview",
      "valueFamily": "color",
      "warningCopy": "Read-only parsed preview metadata."
    },
    {
      "fixtureBacked": true,
      "liveReadBacked": false,
      "previewKind": "color",
      "rawValueRequired": false,
      "rowId": "misc.col.splash",
      "snapshotMetadataKind": "parsedPreviewRowIds",
      "status": "safe-parsed-preview",
      "valueFamily": "color",
      "warningCopy": "Read-only parsed preview metadata."
    },
    {
      "fixtureBacked": true,
      "liveReadBacked": false,
      "previewKind": "color",
      "rawValueRequired": false,
      "rowId": "misc.background_color",
      "snapshotMetadataKind": "parsedPreviewRowIds",
      "status": "safe-parsed-preview",
      "valueFamily": "color",
      "warningCopy": "Read-only parsed preview metadata."
    },
    {
      "fixtureBacked": true,
      "liveReadBacked": false,
      "previewKind": "vector-tuple",
      "rawValueRequired": false,
      "rowId": "decoration.shadow.offset",
      "snapshotMetadataKind": "parsedPreviewRowIds",
      "status": "safe-parsed-preview",
      "valueFamily": "vector_tuple",
      "warningCopy": "Read-only parsed preview metadata."
    },
    {
      "fixtureBacked": true,
      "liveReadBacked": false,
      "previewKind": "vector-tuple",
      "rawValueRequired": false,
      "rowId": "input.tablet.region_position",
      "snapshotMetadataKind": "parsedPreviewRowIds",
      "status": "safe-parsed-preview",
      "valueFamily": "vector_tuple",
      "warningCopy": "Read-only parsed preview metadata."
    },
    {
      "fixtureBacked": true,
      "liveReadBacked": false,
      "previewKind": "vector-tuple",
      "rawValueRequired": false,
      "rowId": "input.tablet.region_size",
      "snapshotMetadataKind": "parsedPreviewRowIds",
      "status": "safe-parsed-preview",
      "valueFamily": "vector_tuple",
      "warningCopy": "Read-only parsed preview metadata."
    },
    {
      "fixtureBacked": true,
      "liveReadBacked": false,
      "previewKind": "vector-tuple",
      "rawValueRequired": false,
      "rowId": "input.tablet.active_area_size",
      "snapshotMetadataKind": "parsedPreviewRowIds",
      "status": "safe-parsed-preview",
      "valueFamily": "vector_tuple",
      "warningCopy": "Read-only parsed preview metadata."
    },
    {
      "fixtureBacked": true,
      "liveReadBacked": false,
      "previewKind": "vector-tuple",
      "rawValueRequired": false,
      "rowId": "input.tablet.active_area_position",
      "snapshotMetadataKind": "parsedPreviewRowIds",
      "status": "safe-parsed-preview",
      "valueFamily": "vector_tuple",
      "warningCopy": "Read-only parsed preview metadata."
    },
    {
      "fixtureBacked": true,
      "liveReadBacked": false,
      "previewKind": "vector-tuple",
      "rawValueRequired": false,
      "rowId": "layout.single_window_aspect_ratio",
      "snapshotMetadataKind": "parsedPreviewRowIds",
      "status": "safe-parsed-preview",
      "valueFamily": "vector_tuple",
      "warningCopy": "Read-only parsed preview metadata."
    },
    {
      "fixtureBacked": true,
      "liveReadBacked": false,
      "previewKind": "gradient",
      "rawValueRequired": true,
      "rowId": "general.col.inactive_border",
      "snapshotMetadataKind": "warningPreviewRowIds",
      "status": "warning-preview",
      "valueFamily": "gradient",
      "warningCopy": "Warning-only or deferred preview metadata; raw value preservation required."
    },
    {
      "fixtureBacked": true,
      "liveReadBacked": false,
      "previewKind": "gradient",
      "rawValueRequired": true,
      "rowId": "general.col.active_border",
      "snapshotMetadataKind": "warningPreviewRowIds",
      "status": "warning-preview",
      "valueFamily": "gradient",
      "warningCopy": "Warning-only or deferred preview metadata; raw value preservation required."
    },
    {
      "fixtureBacked": true,
      "liveReadBacked": false,
      "previewKind": "gradient",
      "rawValueRequired": true,
      "rowId": "general.col.nogroup_border",
      "snapshotMetadataKind": "warningPreviewRowIds",
      "status": "warning-preview",
      "valueFamily": "gradient",
      "warningCopy": "Warning-only or deferred preview metadata; raw value preservation required."
    },
    {
      "fixtureBacked": true,
      "liveReadBacked": false,
      "previewKind": "gradient",
      "rawValueRequired": true,
      "rowId": "general.col.nogroup_border_active",
      "snapshotMetadataKind": "warningPreviewRowIds",
      "status": "warning-preview",
      "valueFamily": "gradient",
      "warningCopy": "Warning-only or deferred preview metadata; raw value preservation required."
    },
    {
      "fixtureBacked": true,
      "liveReadBacked": false,
      "previewKind": "gradient",
      "rawValueRequired": true,
      "rowId": "group.col.border_active",
      "snapshotMetadataKind": "warningPreviewRowIds",
      "status": "warning-preview",
      "valueFamily": "gradient",
      "warningCopy": "Warning-only or deferred preview metadata; raw value preservation required."
    },
    {
      "fixtureBacked": true,
      "liveReadBacked": false,
      "previewKind": "gradient",
      "rawValueRequired": true,
      "rowId": "group.col.border_inactive",
      "snapshotMetadataKind": "warningPreviewRowIds",
      "status": "warning-preview",
      "valueFamily": "gradient",
      "warningCopy": "Warning-only or deferred preview metadata; raw value preservation required."
    },
    {
      "fixtureBacked": true,
      "liveReadBacked": false,
      "previewKind": "gradient",
      "rawValueRequired": true,
      "rowId": "group.col.border_locked_inactive",
      "snapshotMetadataKind": "warningPreviewRowIds",
      "status": "warning-preview",
      "valueFamily": "gradient",
      "warningCopy": "Warning-only or deferred preview metadata; raw value preservation required."
    },
    {
      "fixtureBacked": true,
      "liveReadBacked": false,
      "previewKind": "gradient",
      "rawValueRequired": true,
      "rowId": "group.col.border_locked_active",
      "snapshotMetadataKind": "warningPreviewRowIds",
      "status": "warning-preview",
      "valueFamily": "gradient",
      "warningCopy": "Warning-only or deferred preview metadata; raw value preservation required."
    },
    {
      "fixtureBacked": true,
      "liveReadBacked": false,
      "previewKind": "gradient",
      "rawValueRequired": true,
      "rowId": "group.groupbar.col.active",
      "snapshotMetadataKind": "warningPreviewRowIds",
      "status": "warning-preview",
      "valueFamily": "gradient",